[
  {
    "rule_id": "LM-C01",
    "category": "COMPLETENESS",
    "description": "Verify that net quantity value and unit are declared.",
    "legal_basis": "Legal Metrology (Packaged Commodities) Rules, 2011, Rule 6(1)(c)",
    "effective_from": "2011-04-01",
    "effective_to": null,
    "applicable_when": "commodity.is_exempt == false",
    "condition": "exists(net_quantity.value) AND exists(net_quantity.unit)",
    "severity": "BLOCKER",
    "on_fail_code": "MISSING_DECLARATION",
    "min_field_confidence": 0.75,
    "confidence_policy": "structural",
    "citation_verified": true
  },
  {
    "rule_id": "LM-C02",
    "category": "COMPLETENESS",
    "description": "Verify that Maximum Retail Price (MRP) is declared.",
    "legal_basis": "Legal Metrology (Packaged Commodities) Rules, 2011, Rule 6(1)(e)",
    "effective_from": "2011-04-01",
    "effective_to": null,
    "applicable_when": "commodity.category != 'alcoholic_beverage' AND commodity.is_exempt == false",
    "condition": "exists(mrp.value)",
    "severity": "BLOCKER",
    "on_fail_code": "MISSING_DECLARATION",
    "min_field_confidence": 0.8,
    "confidence_policy": "structural",
    "citation_verified": true
  },
  {
    "rule_id": "LM-C03",
    "category": "COMPLETENESS",
    "description": "Verify that manufacturer, packer, or importer name and address details are declared.",
    "legal_basis": "Legal Metrology (Packaged Commodities) Rules, 2011, Rule 6(1)(a)",
    "effective_from": "2011-04-01",
    "effective_to": null,
    "applicable_when": "commodity.is_exempt == false",
    "condition": "exists(manufacturer_or_packer_or_importer.name) AND exists(manufacturer_or_packer_or_importer.address)",
    "severity": "BLOCKER",
    "on_fail_code": "MISSING_DECLARATION",
    "min_field_confidence": 0.7,
    "confidence_policy": "structural",
    "citation_verified": true
  },
  {
    "rule_id": "LM-C04",
    "category": "COMPLETENESS",
    "description": "Verify that imported products declare Country of Origin.",
    "legal_basis": "Legal Metrology (Packaged Commodities) Rules, 2011, Rule 6(1)(a) Proviso",
    "effective_from": "2018-01-01",
    "effective_to": null,
    "applicable_when": "commodity.is_imported == true AND commodity.is_exempt == false",
    "condition": "exists(country_of_origin) AND country_of_origin != ''",
    "severity": "BLOCKER",
    "on_fail_code": "MISSING_DECLARATION",
    "min_field_confidence": 0.75,
    "confidence_policy": "structural",
    "citation_verified": true
  },
  {
    "rule_id": "LM-C05",
    "category": "COMPLETENESS",
    "description": "Verify that month and year of manufacture/pre-packing/import are declared on physical packaging.",
    "legal_basis": "Legal Metrology (Packaged Commodities) Rules, 2011, Rule 6(1)(d)",
    "effective_from": "2011-04-01",
    "effective_to": null,
    "applicable_when": "scan_source == 'package_image' AND commodity.category NOT IN ['bidi', 'incense_sticks', 'lpg_cylinder']",
    "condition": "exists(mfg_date)",
    "severity": "BLOCKER",
    "on_fail_code": "MISSING_DECLARATION",
    "min_field_confidence": 0.7,
    "confidence_policy": "structural",
    "citation_verified": true,
    "_fixture_notes": "Field name corrected from mfg_or_pack_or_import_month_year to mfg_date to match the canonical extraction contract used by every other rule and by compliance-test-cases.json."
  },
  {
    "rule_id": "LM-C06",
    "category": "COMPLETENESS",
    "description": "Verify that consumer care contact details (phone and email) are declared.",
    "legal_basis": "Legal Metrology (Packaged Commodities) Rules, 2011, Rule 6(2)",
    "effective_from": "2011-04-01",
    "effective_to": null,
    "applicable_when": "commodity.is_exempt == false",
    "condition": "exists(consumer_care.phone) OR exists(consumer_care.email)",
    "severity": "MAJOR",
    "on_fail_code": "MISSING_DECLARATION",
    "min_field_confidence": 0.7,
    "confidence_policy": "structural",
    "citation_verified": true
  },
  {
    "rule_id": "LM-C07",
    "category": "COMPLETENESS",
    "description": "Verify that the common or generic name of the commodity is declared.",
    "legal_basis": "Legal Metrology (Packaged Commodities) Rules, 2011, Rule 6(1)(b)",
    "effective_from": "2011-04-01",
    "effective_to": null,
    "applicable_when": "commodity.is_exempt == false",
    "condition": "exists(common_or_generic_name) AND common_or_generic_name != brand_name",
    "severity": "MAJOR",
    "on_fail_code": "MISSING_DECLARATION",
    "min_field_confidence": 0.7,
    "confidence_policy": "structural",
    "citation_verified": true
  },
  {
    "rule_id": "LM-C08",
    "category": "COMPLETENESS",
    "description": "Verify that Best Before or Use By date is declared for perishable goods.",
    "legal_basis": "Legal Metrology (Packaged Commodities) Rules, 2011, Rule 6(1)(da)",
    "effective_from": "2018-01-01",
    "effective_to": null,
    "applicable_when": "commodity.category IN ['food', 'beverage', 'perishable'] AND commodity.is_exempt == false",
    "condition": "exists(best_before_date) OR exists(use_by_date)",
    "severity": "MAJOR",
    "on_fail_code": "MISSING_DECLARATION",
    "min_field_confidence": 0.7,
    "confidence_policy": "structural",
    "citation_verified": true
  },
  {
    "rule_id": "LM-C09",
    "category": "COMPLETENESS",
    "description": "Verify finished dimensions are declared for packaged textiles/fabrics.",
    "legal_basis": "Legal Metrology (Packaged Commodities) Rules, 2011, Rule 6(1)(f)",
    "effective_from": "2011-04-01",
    "effective_to": null,
    "applicable_when": "commodity.category == 'textile' AND commodity.is_exempt == false",
    "condition": "exists(dimensions.length) AND exists(dimensions.width)",
    "severity": "MAJOR",
    "on_fail_code": "MISSING_DECLARATION",
    "min_field_confidence": 0.7,
    "confidence_policy": "structural",
    "citation_verified": true
  },
  {
    "rule_id": "LM-F01",
    "category": "FORMAT",
    "description": "Verify that the declared net quantity unit is a standard SI unit.",
    "legal_basis": "Legal Metrology (Packaged Commodities) Rules, 2011, Rule 11, 12, 13",
    "effective_from": "2011-04-01",
    "effective_to": null,
    "applicable_when": "exists(net_quantity.unit)",
    "condition": "net_quantity.unit IN ['g', 'kg', 'mg', 'ml', 'l', 'L', 'cm', 'm', 'mm', 'N', 'pcs', 'units', 'pair', 'sets']",
    "severity": "BLOCKER",
    "on_fail_code": "INVALID_FORMAT",
    "min_field_confidence": 0.9,
    "confidence_policy": "standard",
    "citation_verified": true
  },
  {
    "rule_id": "LM-F02",
    "category": "FORMAT",
    "description": "Verify that the net quantity value is positive and numeric.",
    "legal_basis": "Legal Metrology (Packaged Commodities) Rules, 2011, Rule 6(1)(c)",
    "effective_from": "2011-04-01",
    "effective_to": null,
    "applicable_when": "exists(net_quantity.value)",
    "condition": "is_numeric(net_quantity.value) AND net_quantity.value > 0",
    "severity": "BLOCKER",
    "on_fail_code": "INVALID_FORMAT",
    "min_field_confidence": 0.9,
    "confidence_policy": "standard",
    "citation_verified": true
  },
  {
    "rule_id": "LM-F03",
    "category": "FORMAT",
    "description": "Verify that MRP is positive and has correct currency marker.",
    "legal_basis": "Legal Metrology (Packaged Commodities) Rules, 2011, Rule 6(1)(e)",
    "effective_from": "2011-04-01",
    "effective_to": null,
    "applicable_when": "exists(mrp.value)",
    "condition": "is_numeric(mrp.value) AND mrp.value > 0 AND mrp.currency_marker IN ['₹', 'Rs.', 'Rs']",
    "severity": "BLOCKER",
    "on_fail_code": "INVALID_FORMAT",
    "min_field_confidence": 0.9,
    "confidence_policy": "standard",
    "citation_verified": true
  },
  {
    "rule_id": "LM-F04",
    "category": "FORMAT",
    "description": "Verify that the printed MRP has the mandatory 'inclusive of all taxes' suffix.",
    "legal_basis": "Legal Metrology (Packaged Commodities) Rules, 2011, Rule 6(1)(e)",
    "effective_from": "2011-04-01",
    "effective_to": null,
    "applicable_when": "scan_source == 'package_image' AND exists(mrp.raw_text)",
    "condition": "mrp.raw_text CONTAINS_PHRASE('inclusive of all taxes') OR mrp.raw_text MATCHES 'MRP.*incl'",
    "severity": "MAJOR",
    "on_fail_code": "INVALID_FORMAT",
    "min_field_confidence": 0.7,
    "confidence_policy": "standard",
    "citation_verified": true
  },
  {
    "rule_id": "LM-F05",
    "category": "FORMAT",
    "description": "Verify that manufacturing date is a valid calendar date and not in the future.",
    "legal_basis": "Legal Metrology (Packaged Commodities) Rules, 2011, Rule 6(1)(d)",
    "effective_from": "2011-04-01",
    "effective_to": null,
    "applicable_when": "exists(mfg_date)",
    "condition": "is_valid_calendar_date(mfg_date) AND mfg_date <= system.current_date",
    "severity": "MAJOR",
    "on_fail_code": "INVALID_FORMAT",
    "min_field_confidence": 0.8,
    "confidence_policy": "standard",
    "citation_verified": true
  },
  {
    "rule_id": "LM-F06",
    "category": "FORMAT",
    "description": "Verify that declared Country of Origin is a valid recognized country and not blank.",
    "legal_basis": "Legal Metrology (Packaged Commodities) Rules, 2011, Rule 6(1)(a) Proviso",
    "effective_from": "2018-01-01",
    "effective_to": null,
    "applicable_when": "exists(country_of_origin)",
    "condition": "country_of_origin IN system.valid_country_list AND country_of_origin NOT IN ['N/A', '-', '']",
    "severity": "MAJOR",
    "on_fail_code": "INVALID_FORMAT",
    "min_field_confidence": 0.8,
    "confidence_policy": "standard",
    "citation_verified": true
  },
  {
    "rule_id": "LM-F07",
    "category": "FORMAT",
    "description": "Verify that consumer care phone number and email are well-formatted.",
    "legal_basis": "Legal Metrology (Packaged Commodities) Rules, 2011, Rule 6(2)",
    "effective_from": "2011-04-01",
    "effective_to": null,